{
  "schema_version": "1.0.0",
  "registry_id": "urn:gew:schema-registry:security-foundation:1.0.0",
  "resources": [
    {"schema_id": "urn:gew:schema:action-journal-entry:1.0.0", "body_digest": "sha256-raw-v1:becb16a537c74de447ec3d9f3ab58bf1598a965796f3490f4c513dc15d722dec"},
    {"schema_id": "urn:gew:schema:action-policy:1.0.0", "body_digest": "sha256-raw-v1:9946a9ad46581a966163b0b53d7c55fb7200cf6e35f8736af1fa9654f0093a56"},
    {"schema_id": "urn:gew:schema:authority-envelope:1.0.0", "body_digest": "sha256-raw-v1:27bb9a5ef180225851b8aafb131ef1dd7cf4b12763e5c239600c3627e276efbb"},
    {"schema_id": "urn:gew:schema:data-disclosure-plan:1.0.0", "body_digest": "sha256-raw-v1:2cbc5d3ad7db8d1dc05e06f3d0fec1874e9a3cd70bbf4abe902b86ffa137486c"},
    {"schema_id": "urn:gew:schema:disclosure-policy:1.0.0", "body_digest": "sha256-raw-v1:4f3af7eaa36576ecb1950f6947290605e740fc3fcc3bed61c3b9a58356a17792"},
    {"schema_id": "urn:gew:schema:disclosure-receipt:1.0.0", "body_digest": "sha256-raw-v1:f8f8ae943e04a453dcd09969bbceed58ec32c8e0fac27ed88eafbba6737ffe17"},
    {"schema_id": "urn:gew:schema:evidence-policy-registry:1.0.0", "body_digest": "sha256-raw-v1:38add7b1fe501d84ebac258c6b32eef92a921b1922068cf16e11a978bcede3e7"},
    {"schema_id": "urn:gew:schema:evidence-record:1.0.0", "body_digest": "sha256-raw-v1:4a0e7c46a6b7fa2701d9455614d56faaf08d7186f6d7ab9c6d4559f343b299f7"},
    {"schema_id": "urn:gew:schema:input-safety-policy:1.0.0", "body_digest": "sha256-raw-v1:dc309b7d807ac0c13c4c2e5ba47e5f7ac6c1a9524b6637d4b73f4ff20da1d585"},
    {"schema_id": "urn:gew:schema:intent-baseline:1.0.0", "body_digest": "sha256-raw-v1:27409c9223027ce97c7f2bfdde247df534ca59dc602e087b4deafcb8faa9aa09"},
    {"schema_id": "urn:gew:schema:prepared-action:1.0.0", "body_digest": "sha256-raw-v1:65add08cfe44b5cdf853fae9926dd52f6b291b6be823b310f39d810bdf042211"},
    {"schema_id": "urn:gew:schema:redaction-policy:1.0.0", "body_digest": "sha256-raw-v1:4f5d026d01f7644cc1883340bcdf7a6064ffb43b5ca726f864e359a30c7920a5"},
    {"schema_id": "urn:gew:schema:retention-policy-registry:1.0.0", "body_digest": "sha256-raw-v1:f0f1db1966006518811fa14e97d42a8a9441fe72078ed1a98f78ad60c3d32a52"},
    {"schema_id": "urn:gew:schema:security-binding:1.0.0", "body_digest": "sha256-raw-v1:da04b6d4767ca2cde6907a71f5238ee782efd96a25957b389518b4b5927316a7"},
    {"schema_id": "urn:gew:schema:security-runtime-manifest:1.0.0", "body_digest": "sha256-raw-v1:09f95da2c4caf8e0ddf729ae05f0d78a1197643e2e5e41a756fc4c21cc286b07"}
  ],
  "registry_digest": "sha256-jcs-v1:5af3f2ba14d440f50e6194d9ea1aa9bc510e6573a0f19e7a8d564fdf9f0fd9b4"
}
