{"registry_digest":"sha256-jcs-v1:e678e63be62fc5dccd3d3b25d9367db660c25bfd3ef17b965b54696d3c3ee41d","registry_id":"urn:gew:schema-registry:artifact-engine:1.0.0","resources":[{"body_digest":"sha256-raw-v1:e4d95a33078bc80536035de26c2adaada147d6faffa88f4d0112ba7a147829ee","schema_id":"urn:gew:schema:artifact-contract-registry:1.0.0"},{"body_digest":"sha256-raw-v1:a8b74a98d739554e3998387e0d820648d80fe03db36b80e7bf45cde1bac0c314","schema_id":"urn:gew:schema:artifact-lifecycle-event:1.0.0"},{"body_digest":"sha256-raw-v1:c0cdd63cc69d71d43bd45e4deb9dc3e5e26812755d0b0572007d534e6939b28b","schema_id":"urn:gew:schema:artifact-record:1.0.0"},{"body_digest":"sha256-raw-v1:b5adb3a8f2682a694cd7767adc7c5739de1e75e177efed32bc1576340ac0f1c7","schema_id":"urn:gew:schema:logical-body-manifest:1.0.0"}],"schema_version":"1.0.0"}
